ID_POST,post,DATE,nb_comment,nb_view,nb_like,Sentiment,Sentiments_comment,score_pondere,Topics,Topics_text
5770757f5065a7de008b457e,"  Several times  I find the doors of the Velokeller open.  they were still closed. Opened  Picture). Not for the first time. One could also suspect intent behind it, e.g. B. that someone with a key for someone else (without a key, who then comes into the underground car park at , e.g. B. after an incoming car) open? Maybe it's just ignorance. As long as in the Velokeller then a lot of bicycles are only locked (wheels blocked) but not connected to the metal stands, which is also relatively cumbersome with these bike stands, you can run out very easily with a bike with a raised wheel without anyone noticing. It is sad, but unfortunately reality in this settlement. So far  in this underground car park ()  we had a lot of unscrewed roof antennas, a lot of stolen bicycles, at least one punctured tire and at least one broken car. Really great, or just sad.   ",2016-06-27,4,0,0,-0.2912917733192444,-0.4929491681978106,-0.2912917733192444,2,Security
5773c0f66b623e23028b457b,"  Dear    () organizes on .  with the Mobile Youth Work Basel a small info and EM event in the park. On the one hand, it is clearly about watching the quarter-finals and having a barbecue together and enjoying the game on the other hand, a person from the  is also on site to answer questions about the planned youth place. From 8h everyone is therefore cordially invited to take a seat with us, to get to know each other and to talk to each other. There are drinks and barbecues, while supplies last and at 2h the European Championship quarter-final will be shown. If you have any questions or suggestions, please contact us:      ",2016-06-29,1,0,0,0.7300906553864479,0.4990206509828567,0.7300906553864479,3,Activities
5776504c6e63830b018b4571,"  No more oncoming traffic possible on the section of tangent path and this for years  with these barriers on the ""roadway"" ne on the already narrowly designed tangent path? In the upper area (from waste underfloor containers),  therefore regularly use the pavement. Even without this barrier, only a few centimeters of leeway remained for the ""normal"" cars in oncoming traffic to cope without touching each other. (Especially difficult for insecure, inexperienced )  Last discussion 20 he speed limit.  everyone tries to get through as quickly as possible he sees oncoming traffic coming. The barrier must be moved appropriately so that the ""roadway"" channel is free again.   ",2016-07-01,10,0,0,-0.19621242582798,2.426082684425637,-0.19621242582798,0,Parking/Car
57768d858954e82c018b4571,"  On  and , 20./21.  we celebrate on the Erlenmatt with as many  as possible, curious  from the neighboring quarters, etc. a big celebration of the . For young and old there is a varied program with music, games, food, drink, sitting together, dance, fitness, music laboratory, crafts, workshops, stands, children's bouncy castle, football grümpeli, yoga, fun carts, clothes exchange etc. Admission is free. Details about the program as well as how you can contribute to the street festival with a booth can be found at:  The program is constantly being expanded and adapted, so it is best to visit the website regularly. Please mark the date in the calendar in red and tell others!   ",2016-07-01,1,0,0,0.9293757075211032,0.990531293908134,0.9293757075211032,-1,Divers
57768dc38954e82c018b47fd,"  There will be a big street party on the Erlenmatt on  and . Meet your Erlenmatt  as well as people from the surrounding areas! There will be a lot of fun activities for children and , with music, games, food, drinks, dance, fitness, children’s music workshop, crafts, workshops, stalls, bouncy castle, football tournament, yoga, pedal carts, clothing swap etc. Free entry. Programme details and information about how to run your own stall at:  The programme is currently being developed and extended, so check regularly. Please save the date in your calendar and spread the word!   ",2016-07-01,2,0,0,0.909814813057892,0.7881837589666247,0.909814813057892,28,Divers
5777d3576e638388018b4571,  It has again water in the basement and has also flowed into the basement compartments is the first compartment at the entrance of building 18   ,2016-07-02,4,0,0,-0.034960813820362,2.7933533770265058,-0.034960813820362,18,Water
577a52a7b60fd0a8008b457a,"  This comes on construction site A: Seven floors, apartments with 2.5 to 4.5 rooms, sales and catering areas in the basement, known as  are , .     ",2016-07-04,2,0,0,-0.0218801610171794,0.0769326984882354,-0.0218801610171794,8,Apartment
577bf38e0f9540ac008b4571,  I found a key in the garage of    ,2016-07-05,1,0,0,0.3649445511400699,0.0245950818061828,0.3649445511400699,2,Security
577caee40f9540f0008b4572,  A question to my dear  who tried to sleep with the window open  and also  and was kept awake by loud music? I think it's just a cheeky what certain people take out so I ask you if it should come back to the sound as   actually  then call the ! Thank you very much for your help   ,2016-07-06,5,0,0,0.3963071182370186,-2.411165325436741,0.3963071182370186,16,Noise/Music
577d6367219821e5018b4567,"   , the  will meet at  in the Campari Bar at the theater. New  parties are welcome! The   meet at 6pm on  at the Campari Bar near the Theater. New people are welcome!   ",2016-07-06,4,0,0,0.9438812150619924,2.6673833339009434,0.9438812150619924,3,Activities
577e6399644c587f008b4567,"  Hi , I am really wondering if it is just me - I find so called Park in our area both ugly and useless. - very few trees - no shade, not , not in the future - no grass loans for children to play and for adults to make a picnic - overgrown grass everywhere or areas with stones and alpine weed presented as precious samples - high grass is tick danger - I mean the blood sucking insects that like high grass and transfer encephalitis - no play area for little children, The only play area is for - I dont k - I would be afraid to go down the tube as a grown up All other parks in Basel - Kannenfeld, Schützenmatt (see last two photos) are neat and nice and look the same. And full of picnicing people and . How come we got the only bizarre park in town - some  madness? Is everyone else happy with our park? Do you do anything there apart from walking dogs? I personally take the tram to go to Kannenfeldpark with children. What do you do? If I am not the only one with this opinion, may be we can do something about it?   ",2016-07-07,6,0,0,-0.9237406780011952,1.420772721990943,-0.9237406780011952,7,Pet
57803c8700c2d58a008b4567,"   something was done on the ""wild growth""... From my point of view: ""clear-cutting"" without looking at the essentials,,, Don't think that looks particularly good.... .. what about safety, for example, if the dry scrub were to catch fire?  What do you mean? ... am I too ""bünzlig"" ? ;-)   ",2016-07-08,2,0,0,-0.5100731998682022,-1.6436768060084432,-0.5100731998682022,7,Pet
577ff9b900c2d57b008b4569,"  Hello , , a  coming out of the garage had a problem with the garage door on . Unfortunately, I can't say exactly which garage this affects. A white car with the license plate SZ 83984 had blocked the exit so that the  in question could not drive out completely. Unfortunately, the garage door began to close and made a dent in the roof. When the  wanted to talk to the affected woman about it, she simply drove away. I was able to observe this from the balcony and only then came to it. In my opinion, an absolute impudence when you are asked by five people to stop and then just drive away. The   files a complaint with the . Please be careful if someone is forced to stop at the garage entrance.   ",2016-07-08,1,0,0,-0.7147255018353462,-0.0696827806532383,-0.7147255018353462,2,Security
577f4bcc644c58af008b4569,"  Do you also have so hot in your bedroom? Our bedroom is towards the  sun, however we have the shutters down  and it is still 25 degrees hot.   ",2016-07-08,10,0,0,0.1984333023428917,0.3849874828010797,0.1984333023428917,6,Heating
578204fb4c813dcc008b4571,  Hello everyone I have  moved here and wanted to inquire whether there are  parking spaces for the settlement or whether some are still being created? Does anyone know more about this? Thank you very much in advance. Kind regards   ,2016-07-10,2,0,0,0.602900043129921,-0.4492708519101143,0.602900043129921,0,Parking/Car
578356434c813d26018b4572,"  Dear , &nbsp; During the inspection of your property, we found that&nbsp;div. &nbsp;have parked shoes in the stairwell in front of the apartment doors. &nbsp; By signing the rental agreement, you have undertaken to adhere to the existing house rules. It states that in the stairwell there are no objects such as shoes, furniture, plants, etc. may be kept. &nbsp; In accordance with the house rules, we kindly ask you to wear the shoes , 15. , to be removed. The smell is, even according to feedback, very disturbing. &nbsp; We thank you very much for your knowledge, implementation and understanding. &nbsp; Your administration -    ",2016-07-11,1,0,0,-0.4666992574930191,-0.9676339847501368,-0.4666992574930191,-1,Divers
578409db6d0066bf008b4579,"  Are the passages in the basement to the other buildings already used as furniture disposal?!! () I think it's a shame how people just dispose of their things! No consideration is given to others, be it waste, noise during , smearing, etc. you could write a long list! A real pity!!!   ",2016-07-11,5,0,0,-0.9219085625372828,-1.9812446194700897,-0.9219085625372828,1,Garbage
578515759eafcba1008b457c,"  Vegetable subscription of the  Freshness, taste and health directly to your home. Our vegetable subscription in  quality comes with our delivery service to your doorstep. The varied vegetable boxes are an excellent way to comfortably and reliably stock up on quality vegetables for the . For more information, see - Veggie-Subscription from  Fresh, tasty and healthy orders directly to your doorsteps. We will deliver our vegetables in organic-demeter quality directly to your house. Our veggie-boxes are an excellent and convenient choice to purchase  supply of high quality vegetables hassle free. Further information can be found here:    ",2016-07-12,1,0,0,0.9273635726422071,0.9875136588234454,0.9273635726422071,19,Food
5785fe239c7d09c3008b458f,  I don't think it's okay that nobody cares about the defective door lock at the main entrance at . The problem has been going on for almost  and has been reported several times. Have a nice day to all   ,2016-07-13,4,0,0,-0.8059871923178434,-3.10231452062726,-0.8059871923178434,2,Security
578603a59eafcbf3008b4572,"  Yes, it rained a lot, but there is still water in the bike room and in front of the stairs from the basement to the ground floor there is still a puddle along the wall. Do we have to wait until the heating is switched on again and the whole thing then dries off like this?  Or maybe someone will find out where the water finds its way into the basement - it does not seem to flow over the external staircase. Does anyone have an idea for a 's wage?   I wish everyone a nice day.   ",2016-07-13,3,0,0,-0.2662353813648224,1.5040063802152872,-0.2662353813648224,-1,Divers
578a18eb06f34d0d018b457c,  Took a shower  and there was almost no more water! Who has the same problem and has it already been reported to the administration?   ,2016-07-16,6,0,0,-0.1939156800508499,-1.5251701287925243,-0.1939156800508499,-1,Divers
578ca46b94176dc0018b4569,"  Dear Type> , we received a letter from the construction and Type> Type> of the Erlenmatt district, on which an e-mail address of the responsible Type> Type> for the survey / content was written on it. Unfortunately, I no longer have the letter and wanted to ask if I could get the e-mail address/Tel.-Nr. could somehow send to the Type>. Thank you very much! M.M.   ",2016-07-18,4,0,0,-0.4131220281124115,-1.2201917935162785,-0.4131220281124115,11,App
578ca81d94176dc1018b456e,"  Dear  and administration I have  noticed once again that nicotine-soaked cigarette smoke flows from the ventilation system into my apartment (). Above all, this is annoying when it is blown into the bedroom. It ""stinks"" to me tremendously. I don't k where the access pipes for the fresh air run outside, but could a general smoking ban be enforced near it or at least the filters strengthened? Who does what with his health, is me wurscht, but that others are bothered by it, in my opinion, is not possible. Please smoke elsewhere, such as near the fresh air system. Thank you very much. M.M.   ",2016-07-18,3,0,0,-0.9168090568855404,0.0191283375024795,-0.9168090568855404,12,Ventilation
578f1beb83e2a393008b4569,"  I mean that a salsa dance event was once advertised in the , but I can no longer find it. Is there an active salsa group here?   Best regards    ",2016-07-20,1,0,0,-0.4051025882363319,-0.0282435230910778,-0.4051025882363319,3,Activities
578fd0b283e2a3ec008b4567,"  Hello everyone Does anyone else on construction site F have problems with the cladding of the light switches which falls off / breaks off? If so, how did you fix it?   ",2016-07-20,5,0,0,-0.5112381242215633,-2.702890906482935,-0.5112381242215633,21,Light
579131f283e2a382018b4569,"  Hello zäme, ha 😊 scho lang nüme e Rächnig vo de Quikline becho. Händ er au das problem oder klappez bi euch?lg    ",2016-07-21,4,0,0,0.4403736051172018,-0.0282639972865581,0.4403736051172018,33,Allemand
5794bb195bbc7f13018b4581,"  Hi everyone as I noticed , there are really people who tear open foreign packages down in front of the entrance to the garage to see what is inside! So you can look undisturbed without being noticed. ""It wasn't my package"" However, I find this an absolute impudence!! In any case, I will also inform the administration of what is happening here. Can't you even order something without what is stolen??!!   ",2016-07-24,6,0,0,-0.8147762883454561,-1.7556784423068166,-0.8147762883454561,4,Package/Post Office
5795001dd6466b06018b4596,  Hi Zäme   Ich han mal welle Froge ob euchi Wohnig au so dreckig öbergeh wor isch? I han mösse 3x di ganz Wohnig Putze bis sie wörkli suuber gsi isch. Take me wonrs be you gsii isch.. Greetings    ,2016-07-24,2,0,0,0.2966858427971601,0.1339756436645984,0.2966858427971601,33,Allemand
5795094b5bbc7f1e018b4577,"  When will the entrance door at  finally be repaired?!  It is really very tedious and cumbersome, that does not have to be!   ",2016-07-24,2,0,0,-0.9036986911669374,-0.2533649827819317,-0.9036986911669374,2,Security
57960361d6466b69018b4575,   cars were broken into in the underground car park.  the  are in possession of a remote control. Probably they will come back.... Please keep your eyes open and inform the  immediately!   ,2016-07-25,21,0,0,-0.4612804017961025,-6.671599346678704,-0.4612804017961025,30,Parking/Car
5797210b6c03d27a008b4567,"  For the sake of interest, a judgment of  of the B u n d e s g e r i c h t La u sa n n n e  Video surveillance in property with rental apartments              (attached via PDF)   ",2016-07-26,5,0,0,-0.0362939536571502,-2.1147096939384937,-0.0362939536571502,-1,Divers
57983be128056486008b4590,  Good morning Already funny  I could still ride bikes  plates.Again something like that I will turn on far more measures  Rear and  front people stop. Appeal to people mind thank you   ,2016-07-27,11,0,0,0.4843985885381698,-4.286313895136118,0.4843985885381698,2,Security
5798db96280564ef008b456d,"  Hello! I am looking for an underground parking space from 27.7. to 3.8. Does anyone have an idea? Best regards,    ",2016-07-27,1,0,0,0.2027258984744548,0.9452836562413722,0.2027258984744548,0,Parking/Car
579bb32afc67fd86018b4570,"  Dear , it can really be so difficult to close the front door behind you, or to see that it is really right to please??!!  a package has been stolen from me for the second time! I don't find this funny anymore!! I called the post office and demanded a ""do not deposit parcels"" as I can't always be home . From  on, nothing will be stolen from me anymore! Get fed up! The post office said that every  can call himself if you do not want the  to simply deposit the package in the house entrance.    ",2016-07-29,5,0,0,-0.9242267534136772,-3.041658664587885,-0.9242267534136772,4,Package/Post Office
57a2259335817b8f008b4569,  Hello everyone does anyone have a Hilti (big drill) that they could lend us for two holes? Thank you very much    ,2016-08-03,2,0,0,0.9117420348338784,0.8223446293268353,0.9117420348338784,13,Construction
57a3089135817bd7008b4567,"  For : Tips & Information  exercise is irreplaceable for dogs. What is the situation in the Erlenmatt? Here  will find important information about walking. Erlenmattpark As you can see on the map, there is a ban on access for dogs on the meadows and on the playground. Exceptions are the path areas, where the four-legged  must be taken on a leash. More information  This regulation is also signposted and it is important that the  here take on a role model function for outsiders. Alternative options  In the nearby Horburgpark there is a dog playground where dogs can roam freely in a specially built area. An optimal possibility for a longer run is the river Wiese, where there are beautiful paths with sufficient green areas. Also in the adjacent park Lange Erlen you can take dogs on a leash. A matter of course is the collection of the feces and the disposal of the waste bags in waste bins. Anyone who violates this rule must expect a fine of 100 francs and, above all, the anger of their fellow human beings. Tip: If you are looking for someone to go for a walk  and then, you can try your luck on the erlenapp. Motivated  have already been found here several times.   ",2016-08-04,2,0,0,-0.1961367651820182,-0.5872893780469894,-0.1961367651820182,7,Pet
57a4587853943dbc008b4569,  The preparations for the first festival of the  on the Erlenmatt are in full swing! We are looking forward to a fun and colorful party! Visit us on Facebook at    ,2016-08-05,1,0,0,0.986259414406959,0.9880716211628168,0.986259414406959,3,Activities
57a75d4d53943d3f018b4589,  Hello everyone Does anyone have a parking space for rent in the underground car park  from  (10.8) to  (15.8)? My  comes to visit with two young children and we would be very grateful for a parking space nearby!   ,2016-08-07,1,0,0,0.8896591262891889,0.9556103827198968,0.8896591262891889,0,Parking/Car
57a7105953943d2e018b4586,"  Could someone perhaps lend us a compass? We go hiking in the mountains. Thank you very much Hi. Could anybody lend us a compass, please? We're going hiking in mountainous areas in Wales. Thank you very much.   ",2016-08-07,9,0,0,0.8419961985200644,4.950838546268642,0.8419961985200644,-1,Divers
57a898d535817b6d028b4583,"  Just saw the note that the door in the gate must always be locked with the key. The reason is that no unauthorized persons come to our cars. I personally find it a joke, because the main gate is always open and everyone can get access to everything through the door on the side. Basement compartments, apartments and parking spaces are all accessible through this door. However, these two doors are not lockable, as they have no lock at all...   ",2016-08-08,1,0,0,-0.245175763964653,0.1443980932235717,-0.245175763964653,2,Security
57a8c216d44ce069008b4577,"  We just came home . Under the mailboxes on the ground we found an open ""small package"" from Canada Addressed to:  Can be picked up at  Can someone from house 34 who is reading this please inform . Thank you.    ",2016-08-08,1,0,0,0.4788337964564562,0.9863884004298598,0.4788337964564562,4,Package/Post Office
57ac9c4d20b48364008b4569,"  Unfortunately, the gate of the underground car park  () does not close again. I sent a message to the service center, but I don't know if someone else has already reported the defect. By the way: Does anyone know whether there is an emergency number for such cases (broken gate outside office hours) where you can report directly?   ",2016-08-11,11,0,0,-0.7217048229649663,-2.0190900582820177,-0.7217048229649663,2,Security
57af23d420b48387018b47f5,"  Dear , for our celebration  we are still looking for some  who have the desire and time to be there for some time as , e.B. on  from  (tent setting up), on  for further construction as well as  and  for general jumping and helping activities. Send us an e-mail to .erlenmatt@gmail.com with the message when you could be eligible for an assignment. We will then get in touch. Thank you very much already ! Ambassadoren Erlenmatt   ",2016-08-13,1,0,0,0.8605663776397705,0.89891716837883,0.8605663776397705,3,Activities
57b0acda20b483e5018b4584,"   , : Does anyone else have a problem with the TV?  No signal although everything is OK connected.   ",2016-08-14,2,0,0,-0.244769662618637,-1.221847714856267,-0.244769662618637,5,Internet
57b22e762df4dff7008b458d,"  Dear , it's  and we all have warm in the apartments. Would it still be possible for  to run quieter at  and the windows would be closed??? It echoes from the rented apartment in the building ""Im Grün"" to the building ""Im Holz"" and robs various  in the house no. 20 on various floors the sleep. Thank you and good night!!!   ",2016-08-15,1,0,0,0.6164570096880198,0.5537401847541332,0.6164570096880198,16,Noise/Music
57b2a10e2df4dfff008b456d,"  Radio probably did not run as  in building ""Im Grün"" No. 22 but on the construction site ""Im Holz"" !!! As the noise was still present  before the start of the construction work!   ",2016-08-16,1,0,0,-0.5308804735541344,0.0138885155320167,-0.5308804735541344,16,Noise/Music
57b2c5bd1eef6c70018b456e,"  , the garage door at  is only blocked halfway up for a change... The repair service is already informed. By the way, there is a (free) emergency service number, which you can also call outside :  (apparently noted inside the gate). This number applies to the first underground car park (), I do not know about the other garages.   ",2016-08-16,5,0,0,-0.1520962044596672,-2.4490069514140487,-0.1520962044596672,2,Security
57b308591eef6cbb018b4567,"  Hello everyone I live on  on construction site F (i.e. house numbers 21-27). Since purchasing in , I have had a Vivo L subscription from , which would allow me a maximum download and upload rate of 300 Mbit/s. Since I had an even faster connection from  at the old address, I accepted that everything seems to go a little slower here. Since we compared the values among   by means of a speed test on the Internet, I was amazed that my result was always below 100 Mbit/s and always around 95 Mbit/s down- and upload. According to , we have a fibre-optic connection on site F on Erlenmatt. Up to 1 Gbit/s should be possible. What speeds do you have? Where is the bottleneck? I connected my PC via the multimedia socket via Ethernet cable which would allow more than 100 Mbit/. I then asked in the  forum and there some  consider it possible that cables were installed in the superstructure which only allow up to 100 Mbit/s (see attached screenshot). Or is it the Y-cables in the distribution box that slow down the whole thing? Can anyone here report on experiences? Does anyone achieve more than 100 Mbit/s on site F via cable? So far it looks like I paid for an unnecessarily fast subscription for almost , but was slowed down to the performance of the cheaper subscription!   ",2016-08-16,14,0,0,0.6583944782614708,1.2223941662814468,0.6583944782614708,5,Internet
57b4c06d1eef6cd2028b456f,"  Dear   On  our festival of  starts. Would any of you have a gas grill/charcoal grill that we could borrow for the party? Best regards, The  Dear  On  is our Neighbourhood Party. Does anyone could lend us a grill for the BBQ? Best regards The    ",2016-08-17,3,0,0,0.4606707119382918,1.6358648985624311,0.4606707119382918,-1,Divers
57b3ffa92df4df9e018b4567,  Hello everyone Is it possible to overturn windows? () Greetings   ,2016-08-17,5,0,0,0.4783293232321739,0.3795840617967769,0.4783293232321739,-1,Divers
57b6e6af1eef6cd3038b4609,"  Hello has anyone already found a working way to have a defective dishwasher repaired under warranty. The following has already been tried: 1) Message about  > no reaction) 2) Call  > the department responsible for  is so overloaded that they cannot get away with the processing) 3) Call the telephone number, which is given in the  under ""My apartment"" as  customer service (+41 ) (> brushed off by a nice gentleman, I should contact  customer service directly) 4) Call the  customer service > only answering machine, callback did not take place) Would appreciate further suggestions... Anonymous   ",2016-08-19,2,0,0,-0.3424623906612396,0.3162720925174653,-0.3424623906612396,-1,Divers
57b9a5542df4df12048b4571,"  We have sent the following e-mail to the administration: By:  [.@gmx.ch] Posted: , 21.   An:	  .@adimmo.ch Cc: .@adimmo.ch Cc:  Subject: Garage door  Hello Mr.       and also  , 21.8. it is once again only limited  possible to exit the garage ().   The gate blocks halfway up. So far we have still managed the garage without   to leave.   Slowly it becomes a trauma, this garage door.   Who is liable for any damage to the car? Who pays for the taxi if I can't leave the garage? What does the delivery company actually do to finally repair the damage?   We ask you to exert appropriate pressure on the company  so that the drive  is replaced immediately. Likewise, the company  must be asked to:  to finally have these warranty defects remedied.   We ask for an action plan from the manufacturing company on how and when the problem will be resolved.   Sincerely,  B + B Rupp   ",2016-08-21,9,0,0,-0.4855477213859558,0.7945325809996575,-0.4855477213859558,2,Security
