ID_POST,post,DATE,nb_comment,nb_view,nb_like,Sentiment,Sentiments_comment,score_pondere,Topics,Topics_text
5c46306fd3f86e00681f51c4,"  Hello everyone, I rent from  or by appointment, until the  my beautiful furnished and fully equipped 3.5 room apartment at Maneggplatz. Miete CHF 1950.-. For more information contact me directly:  or    ",2019-01-21,2,157,3,0.6282123089767992,0.8419601919595152,0.816676001669839,8,Apartment
5c46ca3bd3f86e00704444c6,  In the green waste container of the  are plastic bags and a paper bag. Sorry : These fabrics are not compostable. The whole load is therefore worthless. Only the compost bags (those with the diamond pattern) are compostable.   ,2019-01-22,2,217,19,-0.8123545479029417,-0.6747877644374967,-0.9667019120045006,1,Garbage
5c470db9bea4570067339376,"   the  was supplied with dairy products from the  in Adliswil - all  quality! And,  even came with his carriage. That's organic ;-)  Delivery with horse always comes  before noon, but unfortunately not  - depending on the weather and the horses' run We are very pleased that  supplies us! Your  team in Zurich Manegg PS: if you need horse manure for your planting boxes, you can pick it up directly in front of the olive.  still fresh ;-)   ",2019-01-22,4,134,45,0.8139916975051165,3.252527826698497,1.1802879613824189,19,Food
5c48a57f5bcd02006c22119a,"  In our house () various packages have been stolen . , a  and I discovered that someone had deposited the empty boxes of our stolen packages in the elevator. Has anyone seen the person who deposited these packages in the lift ? We are considering filing a complaint and are grateful for any hint.   ",2019-01-23,1,199,2,-0.4165949374437332,-0.9394890707917511,-0.4999139249324798,4,Package/Post Office
5c48ac17bea4570067339f60,   2 packages (1  & another) were stolen from us at  (addressed for ). WHO STOLE IT?? zum3. Be. I will  call in the police!!!! the person should contact us as much as possible? what kind of dirty behavior is that honestly!!!!!   ,2019-01-23,4,309,3,-0.9516825003083796,-1.5121989948675036,-1.2371872504008936,4,Package/Post Office
5c49e0f54d5e54006b5451ac,"  The newspapers at Spinnereiplatz  were not picked up . I spoke to the , Mr , on the phone. He promised me to clarify it and inform me. I have also informed Mr , and he is of the opinion that the  has forgotten to take them with them and expects them to be picked up.   ",2019-01-24,4,147,6,-0.5208217930048704,-1.4548944737762213,-0.8333148688077927,-1,Divers
5c4a158d2c49bc0068776564,"  Hello everyone For a long time I had seen a notice upstairs in the game room concerning a fitness room of the cooperative. Unfortunately, I did not take a photo 🤳 and  I don't k where exactly this can be found. I would like to register and do sports again. I thank you in advance for your feedback. Best regards,    ",2019-01-24,1,158,1,-0.3056013286113739,0.0638487488031387,-0.3361614614725113,-1,Divers
5c4ae7a8f336b1006b7795e1,"  The paper has just been picked up at  Thank you, , for reporting to the !   ",2019-01-25,1,94,6,0.9128437887411563,0.973252951167524,1.4605500619858502,-1,Divers
5c4dd081510d74006a39a7a3,  Does anyone have a jigsaw that I can borrow?   ,2019-01-27,1,67,2,-0.0036402195692062,0.2051127487793564,-0.0043682634830474,32,Tool
5c4e3c516043fd0071682e1f,"  Hello everyone I miss again a package of.  ( tracking Nr ) . It was apparently received  at . Unfortunately, it is still untraceable... I am glad if soon cameras are attached, it 1. is not the first time and 2. my work suffers from it. My package would have been my entire next order that is missing .   ",2019-01-27,6,258,7,-0.4717453867197037,-2.5706250546500087,-0.8019671574234962,4,Package/Post Office
5c4ed044b7f0c0006e471939,"  Dear , I am moving out of my 3.5 room apartment at  at the  and thus the apartment will be free for a new  from . The apartment is located in the 1. Upper floor, the living area is 73.3 m2 and the loggia / balcony is 21.9m2. Washing machine and tumbler are available in the Reduit. Together with the apartment, a parking space is also rented in the garage directly at . The apartment can be visited at any time, just contact  (during  What's App,  also call) if there is interest or if there are general questions. The administration  is also informed, more detailed information can also be obtained from them. The rent for the apartment is 2300.- incl. Additional costs, for the parking space it is 180.-, both prices per month. Kind regards,  Dear , I will move out of my 3.5 room flat at   and the flat will be available for the next  from  on. The flat is on  floor and it’s 73.3 m2 for the 3.5 rooms and 21.9m2 for the loggia / balcony. Washing machine and tumbler are available in the reduit. As it’s quite of importance for new , a parking lot at  will also be free to rent. A viewing appointment can be arranged , feel free to reach out to me on my mobile  (What’s App during , calls ) if you’re interested or if you have any questions.  is also informed about the availability of the flat, more information can also be requested from them. The  rent for the flat is 2300.- and for the parking lot it's 180.-, both per month. Kind regards,    ",2019-01-28,3,252,1,0.3785003274679184,0.7802605228498578,0.4163503602147103,8,Apartment
5c51c9235539a8006f7a668f,"  Dear Women, I have free appointments again from . Time we take, is time that gives us something...   Best regards,    ",2019-01-30,1,112,3,0.8127249048557132,0.9793161551933736,1.056542376312427,-1,Divers
5c51e407773e83006e1e40eb,"  Dear , has any of you hung a larger picture on an outer wall (wall between two apartments or outside, no partition wall inside the apartment)? Was that possible with nails or do you have to drill? ,  and .   ",2019-01-30,3,17,0,-0.0872265473008155,1.652292398037389,-0.0872265473008155,13,Construction
5c547ad1938c9e006837b31e,  #greencity I would be for a free car wash one mail  😅   ,2019-02-01,3,235,9,0.7486460795626044,-0.8085196800529957,1.4224275511689484,-1,Divers
5c556224cdee02006853b2c0,"  Hello dear ,  we get spontaneous  from home. Someone who does not need his parking space the ? Would be great if someone can help out. Lg  and      ",2019-02-02,1,76,0,0.5398103781044483,0.7026037718169391,0.5398103781044483,0,Parking/Car
5c56d8edf2853d006c592af4,"  Also many thanks for the commitment on the spinning mill. However, I am not sure whether the clean-up or relocation campaign made sense. It was of little use - bags, cardboard boxes, plastic were and will continue to be deposited on and next to the garbage heap. Perhaps the pile of waste in the middle of the street would have been more daunting. I don't know. In recent weeks, I have repeatedly brought waste into my cellar compartment and later disposed of it legally - according to the motto: resist the beginnings. But that doesn't really make sense either. I am interested in setting up a working group ""-waste-déchets-"". We are looking for  of  and   (later also , 8 85, 87, 89), , , 22, 34, , 48, 50, 70, 72. Ideas:  Creation of multilingual information sheets. Permanently mounted information board on the spinning mill. Contact with , , . multilingual waste newsletter on Greencityapp. Reorganization of cardboard collection with ""garbage coaches""? Who can imagine working with us?   ",2019-02-03,5,208,19,-0.4293710514903068,3.5400274872081354,-0.510951551273465,1,Garbage
5c56eca6f2853d006c592dc5,  On the topic below: it is boring but apparently some people are unteachable: NO; PLASTIC IS NOT COMPOSTABLE! Even a complete chicken as content does not change anything!   ,2019-02-03,1,90,14,-0.9235862819477916,-0.8310583233833313,-1.0528883614204825,1,Garbage
5c5863c605679b006935f2a5,"  Dear , someone drives in the time of 8. - 22.  to the ski holidays and would leave us his parking space? Individual days would also be a great help. We are also happy to contribute to the rental costs for this time. Please send your feedback to  or  Thank you very much!    ",2019-02-04,1,91,3,0.9056773842312396,0.0443041548132896,1.1773805995006117,0,Parking/Car
5c5927df05679b006710c72b,  Dear  I would like to have a few walls in the apartment painted in color. Did any of you do the same and can recommend a ? Thanks for your tips!   ,2019-02-05,4,207,4,0.6222772495821118,2.828778592753224,0.8711881494149565,-1,Divers
5c5ae18805679b006c2fd872,"  We also rent our parking space in the period from 13.3. to . It is in the underground car park of . The rent is 200 CHF per month. If you are interested, please write or call . VG,    ",2019-02-06,3,71,1,0.0915305465459823,1.5304219354875386,0.1006836012005805,0,Parking/Car
5c5b3ea57dc88400702dc496,"  Hello everyone Did this book from  appear somewhere (addressed to )? Delivered according to post, but not findable. I doubt that a suspected parcel thief can be seriously interested in this book... Thanks for info! LG    ",2019-02-06,1,81,3,-0.5390376225113869,0.2437387770041823,-0.7007489092648029,4,Package/Post Office
5c5c125d857ef50069059693,"  Dear  ! , we discussed here for the first time the idea of a community refrigerator as a measure against food waste. I met  with , who would support the idea of a fair divider in . Some   - including  - even live in .  has a lot of experience with fair dividers and already has several in operation in the city of Zurich ( It makes sense to have a combination of a normal cupboard and refrigerator, which could be publicly accessible (on the street) or in a building (e.B. in a GZ). The fair divider would be filled with food from private households and also supermarkets or restaurants. The filling and cleaning is done by  , i.e. if we find a few additional food waste  in the , this would be taken care of. There are already rules and best practices as to what is allowed into the fair divider and what is not. As a next step, we would like to determine possible locations in the  and then the cooperatives or pick up the responsible . Furthermore, we thought about pitching at the next  (, , , ) meeting on 15.4 to get an OK. What do you think - what would be a sensible location and who would be the appropriate contact person?   ",2019-02-07,10,271,29,0.592159416526556,4.00014040467795,0.7638856473192572,1,Garbage
5c5bfa91351f16006c59112d,"  Huete in the Olive ()  - Organic pasta with onion cream sauce: 17.00 CHF - Organic Vegi plate, yoghurt and with pomegranate sauce: 16.00 CHF - Organic Wirz soup, Vielot potato, chickpeas, carrots 9.50 CHF   ",2019-02-07,1,27,4,0.0785419829189777,0.9766370868310332,0.1099587760865687,19,Food
5c5da2bcf0b46f006945e5da,"  Hi everyone, I've read the posts about the stolen packages and I'm a little worried. Does anyone already live at  and can tell me what the conditions are there? Thank you!   ",2019-02-08,6,23,1,-0.2269322574138641,-0.5151427472010255,-0.2496254831552505,4,Package/Post Office
5c5d4e29afade6006c6156f3,  From the 26. In  we are also at home in the Green City! :-) Are there a few  among you? We are looking forward to it! Lg  &    ,2019-02-08,1,190,9,0.9712841459549963,0.9745871301274748,1.8454398773144929,-1,Divers
5c60635f0b688a006b071a3d,"  Movie . ,  We look forward to seeing you! Best regards,  and    ",2019-02-10,2,110,9,0.976592383463867,-0.0722214467823505,1.8555255285813472,3,Activities
5c612f8f0b688a006e1b9ecd,"  Hello dear , We are looking for a   to look after our 2 . Do you know perhaps to recommend someone from Greencity ? Thank you and have a nice week. Greetings,    ",2019-02-11,1,109,3,0.9225485562346876,0.4554545525461435,1.199313123105094,3,Activities
5c629421d93e22006b19526f,"  Dear all,  we have lost our blue suitcase (cardboard). Lots of dental utensils were in it, mouth mirrors etc. And  thinks she saw him outside for the last time. Has him ev. someone found/seen? Heartily  Against   ",2019-02-12,2,136,8,-0.4145759604871273,0.8181645339354873,-0.7462367288768291,1,Garbage
5c63e4a1c5c2c4006b21f338,   in the Olive ()  - Organic vegetable stew with organic minced meat (beef ch) with bulgur and yoghurt: 18.00 CHF - Vegi organic vegetable stew with bulgur and zaziki: 16.00 CHF - Organic pasta with tomato cream sauce: 15.00 CHF Kids Menu - Organic pasta with tomato sauce:  child 4.50 CHF Danke Olive Team   and    ,2019-02-13,1,61,4,0.0261742919683456,0.8933980129659176,0.0366440087556838,19,Food
5c652f920444d1006e05f799,   in the olive () :)))  - Organic chicken leg (Ch) with vegetable stew and rice (Georgian recipe Black Sea): 18.00 CHF - Organic vegetable stew and rice (Georgian recipe Black Sea): 16.00 CHF - Bio Penne mit Tomatenrahmsauce: 15.00 CHF - Organic yellow lentil soup with bread: 9.50 CHF Thank you  Team   ,2019-02-14,2,50,2,0.7151357750408351,1.963270555366762,0.8581629300490021,19,Food
5c6683ad65f4b9006b2ee924,"  Make your own lip balms and creams. Would you like to know how we can make personal care products ourselves?  Together we make a lip balm and a skin cream. There are simple recipes and I use purely vegetable raw materials.  In addition, we immerse ourselves in the scents of the essential oils that invite us to dream. When:  Where:  building  in common room 3. Stock. Just come by - it doesn't need to register. I look forward to seeing you.    ",2019-02-15,2,62,15,0.899111028527841,1.9014304627198728,1.033977682807017,19,Food
5c6933b962ad8900707b0b47,"  Hoi, do any of you have a workbench or Workplace to grow ski that I could use?   ",2019-02-17,1,63,0,0.0542393084615469,0.1593431867659092,0.0542393084615469,-1,Divers
5c698b4762ad89006c50d408,  Does anyone have an electric bike that she (or he) doesn't need ? I would love to rent it for  to try out before buying my own.    ,2019-02-17,1,118,1,0.7927018897607923,0.342700757086277,0.8719720787368715,2,Security
5c6ac99a77d34a006918cda9,"  Hoi zäme, does someone have a few rein boxes left, which we have from the 23. ==References== May be allowed to borrow? We travel for  and have to clear out part of our apartment because of subletting. Thank you for your feedback. Best regards,    ",2019-02-18,7,170,1,0.5059915855526924,2.573215814656578,0.5565907441079617,8,Apartment
5c6bad4949eac1006930dcc0,  News about the planned school building in the local info:    ,2019-02-19,4,214,12,0.0170552730560302,0.3237790097482502,0.0191019058227538,-1,Divers
5c6dcce0bd8408006a534c41,  I would like to ask does anyone still have reins cardboard? I need it thanks   ,2019-02-20,3,122,3,0.1809651087969541,0.3941890285350382,0.2352546414360403,1,Garbage
5c6d2920881f69006874b3d6,"  Hello dear . I want to share with you an unpleasant situation. Due to the basic cleaning in the garage and in the bicycle room  I wanted to put our bikes in our basement on . When I unlocked our cellar plot door, there was stolen goods from stolen  in it. Just thrown in over the basement door with us. , I didn't want to admit that  go in and out of here and steal from us. But it is also very unpleasant to find stolen packages in your own cellar compartment. I would like to ask all of you to lock the cellar door in the house. Every time I go in there, the door is not locked. Who knows what else will happen... Thank you   ",2019-02-20,3,230,9,-0.8315696008503437,-1.2518504178151488,-1.579982241615653,2,Security
5c7143c11ba2c700674828ec,  Between WOLO and Spinnerei and also at various other places of the area: StoneCity instead of GREENCity :-(((   ,2019-02-23,7,347,15,-0.6516468785703182,2.971730171935633,-0.7493939103558659,3,Activities
5c723d581ba2c70068161762,"  Hoi zäme! Coincidentally, is someone home  between 11.30 and 15.30 and could pick up a package for me (is against signature)?  of course to the appropriate address. LG    ",2019-02-24,3,76,2,0.2568636871874332,1.406762272119522,0.3082364246249198,4,Package/Post Office
5c73dfeedf6e14006f1f82d2,  Can anyone recommend a /?   ,2019-02-25,5,145,1,-0.0668184831738472,0.9897148897871376,-0.0735003314912319,23,Recommendations
5c73e7901ba2c7007029e133,   wanted. It should be as light as possible. Does anyone have one as a second hand to sell?   ,2019-02-25,1,42,3,0.2141933515667915,0.8666762816719711,0.278451357036829,-1,Divers
5c73f3ccdf6e14006d277b4c,  Hello does anyone know how to deliver the code?   ,2019-02-25,8,210,1,-0.2049340717494487,-0.0968183877412229,-0.2254274789243935,-1,Divers
5c743b6311f6dd00703dffc9,"  Parking from 01.03. -  for rent, 150 Fr. per month. If you are interested, please contact us by e-mail:  Greetings    ",2019-02-25,1,34,1,0.228831747546792,0.9271446985658258,0.2517149223014712,0,Parking/Car
5c76571c892646006e23e362,"  Hello Dear   a young man on sticks at the station has done his mischief. He walked on sticks (his left foot plastered) and smashed the coffee box and the poster wall. Unfortunately, I didn't catch him anymore because he was just getting on the train. If someone observes something like this once, be sure to report it. Best regards    ",2019-02-27,5,261,5,-0.8326349295675755,-2.224084632471204,-1.2489523943513632,-1,Divers
5c76a7b22ede6d006a29180d,"  Kartonabfuhr 1.  - Please respect your neighbourhood! Dear   We hope that the cardboard collection from  does not lead to a garbage heap again! We thank you for your help:  Fold, bundle and lace the box, only put it out on . What does not belong in the cardboard collection? Coated or soiled cardboard, paper, polystyrene, tetrapak, frozen packaging. see also Disposal Calendar or  Sincerely,  and ,    ",2019-02-27,7,192,31,0.2667261809110641,4.339775200351141,0.349411296993494,1,Garbage
5c76a8a289264600674fa80d,"  Cardboard collection on  - Please respect your ! Dear  We hope that the collection of the cardboard  does not yet produce a pile of garbage! Thank you for your help: Fold the cardboard, make a pile of it, tie it up. Drop it off only . What is not part of the cardboard collection? Plasticized or dirty cartons, paper, polystyrene, Tetra Paks, frozen food packaging  With our cordial greetings!  and , Arbeitsgruppe Cleancity   ",2019-02-27,2,99,22,0.4173056706786155,-0.1084382534027099,0.5091129182279109,1,Garbage
5c77f61b339928006a36c798,  Hello everyone. Did anyone happen to have contact with  or was thinking about it? It would be very nice to be connected to the  network and I wondered if a request had already been started :)   ,2019-02-28,4,119,10,0.957380665349774,1.8424272688571364,1.0531187318847517,5,Internet
5c77819a892646006c6371bd,"  Start  singing :-)  in Greencity From , 1. ,  Common room Stadtgarten No registration necessary, open to all and free of charge Have a nice day,    ",2019-02-28,7,212,14,0.98027549526887,5.785136473597959,1.1175140646065118,3,Activities
5c7a943e67b1a1006c2cf8f6,  Does anyone already have WiFi / Internet? There seems to be a problem with the municipal utilities for Internet. How did you solve that?   ,2019-03-02,4,189,3,-0.5521606747061014,-0.0198667123913764,-0.7178088771179318,5,Internet
5c7ab80386f770006d79727e,"  OM FAMILY - YOGA   for  +   On this special yoga  we will discover - together with our ren - the diverse world of yoga and sound. Through movement, games, sounds, tones, rhythms and stories, we will immerse ourselves in the moment and get involved with our . We will laugh a lot and make our imagination blossom. We will discover our body and open our senses... can recharge your batteries and relax together. Yoga with ren is a wonderful way to meet each other anew, to learn from each other and to enjoy precious moments of togetherness. You will leave the room with shining eyes and a happy heart!  * * * * * * * * * * *  - DATE: .  - TIME:  - COURSE LOCATION: Someyoga (  - PARTICIPATION / :  with a  (4 -) - BRING: comfortable clothes, not too high expectations of each other :-) - MAX. NUMBER OF : 7 couples ( & ) - COSTS: 70.- per couple incl. Break snack / payment in cash in the studio - KURSLEITUNG:  - REGISTRATION:   - MORE INFO's:    ",2019-03-02,2,76,2,0.9624679288826884,2.005595314782113,1.154961514659226,14,Activities
5c7a596b497f67006e5fc087,"  Dear , we will get  8.3.-10.3. Visit from abroad. If someone has his parking space free we would be very grateful we could use it. (From about  , everything in between is also great!) Lg  ()   ",2019-03-02,1,66,0,0.9213357768021524,0.9182370954658836,0.9213357768021524,0,Parking/Car
5c7d60000955c4006b6ac7db,  Which Internet Provider should I choose?   ,2019-03-04,13,227,1,-0.1400017701089382,2.499881673953496,-0.154001947119832,5,Internet
5c7e40e7c21cc9006f709a5e,  Hi! Has anyone already gained experience with ? Can anyone comment on experiences with ?   ,2019-03-05,2,80,2,-0.0079474300146102,-0.1288206540048122,-0.0095369160175322,23,Recommendations
5c7e4e7c0955c4006806f326,  Where are the nearest containers for Glass? Where is the nearest /used clothing? / Where can the next glass containers be found as well as the /old clothes collection?   ,2019-03-05,6,244,3,-0.1521622613072395,0.8770976793020964,-0.1978109396994113,1,Garbage
5c8120606fcd04006d13a9f9,"  Dear !   Would you like to take part in the big Greencity Festival ?  We put together an organizing committee that will meet regularly for the organization and preparation of the festival. First meeting is on , .  from  in the Olive. Everyone can participate! Would you like to get involved in the district? Would you like to take part in the biggest festival of ? Do you want to meet new ?   Then I'm waiting for you on .  at the first OK meeting! Best regards,      ",2019-03-07,3,182,21,0.6789760978426784,1.4243501976598054,0.8215610783896409,3,Activities
5c8127a0ca85f6006818bdf0,"  3. Movie , 11.  at  we will show another film: ""The Pig of Gasa"". It would be nice if we would sit together a bit after the film. Bring drinks and snacks. Access: At the entrance  the bell: Activate THE COMMON ROOM, then we will open it to you. We look forward to seeing you. Best regards,  and    ",2019-03-07,6,110,11,0.9053238867782056,3.342812461894937,1.0049095143238085,3,Activities
5c8158b36fcd04006c5c64c3,  The city is taking up proposals for the 2020/21 timetable change. Requests for better/more frequent connections to the city can be stated here:  . It's not a bad idea.   ,2019-03-07,6,208,27,0.7500011473894119,3.1774913270492107,0.9525014571845531,-1,Divers
5c82e02394d08c006c12f0cc,  I am looking for a trustworthy . Do you have any recommendations? Thank you in advance for your help.   ,2019-03-08,6,200,5,0.726666895672679,2.702557180076837,1.0900003435090184,23,Recommendations
5c84ec2eca85f6006965bafe,"  WANTED: BOXES! We are moving flat in  and are looking for some boxes. Do you have any boxes and are you willing to lend (or perhaps sell) them to us? As we are moving within Greencity, we can bring the boxes back mid . Please contact us:  Thanks in advance,  and    ",2019-03-10,2,106,0,0.4260465730912983,0.0714152380824089,0.4260465730912983,1,Garbage
5c84ec166fcd04006a4e8035,"  MOVING BOXES WANTED!!! Who has moving boxes that he/she lends to us (or possibly? would also sell)? We are moving within the district at the  and could return the boxes in . Please call  Thank you in advance,  and    ",2019-03-10,1,58,1,0.4639505380764603,0.0549567453563213,0.5103455918841063,1,Garbage
5c84b30494d08c006e6566ad,"  Hello dear , Do you know a  recommended in Greencity? Thank you and a nice .    ",2019-03-10,1,129,4,0.9522098425077274,-0.6560689155012369,1.3330937795108184,3,Activities
5c87e84effa095006b1f13eb,  *** eSMART disruption update *** The app that lets you control your smart home has been down . I talked to  and they said all the Greencity B1N (A-B-C-D) is disconnected. It's due to an issue with  and they are working on a fix .   ,2019-03-12,12,192,11,-0.5191731303930283,1.5133800029288975,-0.5762821747362614,27,Elevators
5c8827e177ec480067147869,  Does anyone k a good  (install lamps)?   ,2019-03-12,1,79,0,-0.0459636598825454,0.8325008172541857,-0.0459636598825454,22,Light
5c88ca8977ec48006b36ec2b,  Restaurant Spinnerei B1N Does anyone know what the stand is regarding the restaurant in the spinning mill? Shouldn't that have been open long ago?   ,2019-03-13,19,571,15,-0.1237679384648799,1.6695403249468654,-0.1423331292346119,-1,Divers
5c896b4e081094006602c10c,  Does anyone have an Allen key with a head smaller than 3mm I can borrow for ?   ,2019-03-13,2,90,2,-0.0147526524960994,0.9903385890647768,-0.0177031829953192,-1,Divers
5c89dac9081094006c325aab,  How to open the entrance door with the tablet?   ,2019-03-14,6,207,5,-0.0674617029726505,-0.0345497732050716,-0.1011925544589757,2,Security
5c8a24e7081094006e2c795e,"  Does anyone have information on the missing towel rails? If not, I’ll contact the agency and give you an update.   ",2019-03-14,11,23,2,-0.1583192162215709,0.7855425805319101,-0.1899830594658851,24,Balcony
5c8a5e0b52cfc900671361f7,  The facades of the Geho building will be greened.   ,2019-03-14,8,244,48,0.2910867156460881,3.5207520819967613,0.4308083391562104,15,Activities
5c8ab77b3b0e9b007066a4b2,"  To the person who stole my umbrella, which was on my doorstep... do you intend to return it??? ()   ",2019-03-14,1,65,1,-0.5446894243359566,-0.4327642805874347,-0.5991583667695523,4,Package/Post Office
