ID_POST,post,DATE,nb_comment,nb_view,nb_like,Sentiment,Sentiments_comment,score_pondere,Topics,Topics_text
55002b8b828463a4178b457b,"The  team is the contact point for all questions about  Need help logging in, changing settings, or uploading images?  Or do you have a change request for ? ,  and their team will be happy to help you. Just write to us at team@.ch.   ",2015-03-11,1,0,0,0.7306173387914896,-0.7674247324466705,0.7306173387914896,11,App
5508260e828463ae4a8b45fa,"  How is a good neighbourhood created? Send the right signal ... Actually, it doesn't take much for a good neighborhood to emerge. Here are four important tips on how to get it right from the start.   ",2015-03-17,0,0,0,0.5370404608547688,0.0,0.5370404608547688,15,Activities
552547e8828463e9288b4586,"  Dear , :  our cat is missing. The cat's name is , it's beige and it's chipped. We have posters everywhere with our phone nr. already hung up, in case someone sees something, we would be happy for every call. We live on the ground floor at the . Thank you very much Best regards,   ",2015-04-08,1,0,0,0.6338082440197468,-0.0264212489128112,0.6338082440197468,7,Pet
552f62c78284636b568b4577,"   we want to know! Your opinion!  in the Erlenmatt West and with the  you certainly already have a lot to say to us: What do you like about the , what can we do better, what are you missing? Click here for the survey: Link to the surveyParticipation in the survey takes ! Thank you very much for participating!   ",2015-04-16,1,0,0,0.7797721615061164,0.9900907715782524,0.7797721615061164,28,Divers
552fa7218284634b608b4581,"  We from the  have the Erlenmattpark right in front of our nose, approx. in  walking distance (cf. blue arrow on illustration). Unfortunately, this path is blocked throughout due to two construction site fences and we have to take a detour of  (cf. red arrow). Is there an alternative that I overlooked? If not, how long will these fences last? Or would it be possible to open a passage in one place?   ",2015-04-16,3,0,0,-0.6910074390470982,0.35491836105939,-0.6910074390470982,0,Parking/Car
5538eba2828463e1218b45af,  What do you think about the ? What do we need to do better? What are you missing? What doesn't work? Your opinion is important to us. Join us ! The survey will only run  . Participation takes 3 Minuten.Link to the surveyThank you very much for participating!   ,2015-04-23,1,0,0,0.7737639173865318,-0.3296846859157085,0.7737639173865318,-1,Divers
553bac0a828463117f8b457f,"  Good morning to everyone, someone has a tip on how to get the tiles in the bathroom really clean???   ",2015-04-25,12,0,0,0.5683129774406552,-2.889668698888272,0.5683129774406552,10,Cleaning
553e00698284638f708b4569,"  Make and maintain contacts in the neighborhood, save waste fees and at the same time sensibly recycle organic waste so that first-class fertilizer is produced... There are many good reasons to compost in the neighborhood! If you want to k more about this and/or would like to compost with us, you  have the opportunity to inform yourself. Free introduction to the topic of ""proper composting"" in cooperation with the compost consultancy of the , 28. , at the composting site Erlenmatt from  to 20:15Registration under  desired. The compost site is located in front of the retirement home ""Senevita"" on the site of the future Max-Kämpf-Platz, directly on .The compost site is looked after by a group from the surrounding district. We are looking forward to more !   ",2015-04-27,6,0,0,0.8613209435716271,-0.303837644867599,0.8613209435716271,1,Garbage
553f3f788284638f708b4711,"  Some of you have already asked us when we can show you the past energy consumption of your apartment for the first time. We have announced this for the , but unfortunately we are late. Sorry. We will keep you up to date and get back to you as soon as ""My Energy"" goes online.   ",2015-04-28,2,0,0,-0.3906839191913605,0.7890345840714872,-0.3906839191913605,17,Energy Consumption
5541f47382846332388b4584,"  Various  have asked if we can explain again how they can save the  on their smartphone like a normal native app. the flyer on which this is described can  be found in the ""Erlenmatt West"" section. Here is the direct link. Write a comment if this does not work or if someone has a smartphone model that is not described.   ",2015-04-30,1,0,0,-0.4848070107400417,0.977839904371649,-0.4848070107400417,11,App
5548d604828463d1198b45f3,"  As perhaps already read in the interview (, I organize on  from 17.45 together with the  team, the railway canteen, the  retirement home, the  and  the first newcomer aperitif in the Erlenmatt West. All information about the program as well as the registration can be found under the following link:  I look forward to seeing you on , 28.  from  in the restaurant ""Le S"" of the  at  If you have any questions, please feel free to contact me via email () or via comment in the  newsstream. See you!   ",2015-05-05,2,0,0,0.782842744840309,1.5189331490546465,0.782842744840309,-1,Divers
554b7961828463b27a8b4571,"  Already heard?  is one of 6  for the Faktor 5 prize.  awards this prize to sustainable projects in the Basel region. If we win the Audience Award, we will use the prize money of 5000.- for rental items on your marketplace! Help us to carry the price home by voting for the erlenapp: click here to vote. Thank you very much!   ",2015-05-07,1,0,0,0.8940971409901977,0.6370972767472267,0.8940971409901977,-1,Divers
554f720d828463cd318b459b,"  Dear , the administration has already informed us three times by letter that cars may not be parked in front of the house. I don't quite understand why this request is not adhered to, but I don't mind it until the administration passes on additional costs to all of us. But the fact that cars are already parked in the underground car park on already reserved parking spaces really does not have to be. I am far from reporting such numbers, but appeal to the fairness of all those who pay for the parking spaces. If the majority of the cars are , it might be up to the administration to find a suitable alternative.   ",2015-05-10,3,0,0,-0.3915087655186653,0.842750234529376,-0.3915087655186653,0,Parking/Car
555517a1828463cb318b47e7,"  It would be very nice if the parking ban signs are better attached, so that they do not hit the grid,   ",2015-05-14,1,0,0,0.1583781689405441,0.8677123091183603,0.1583781689405441,0,Parking/Car
555a173d82846318378b4570,"  Dear  On  the underfloor container was emptied , several Bebbi saws got up again and neber the underfloor container and that although the container was empty and the shaft was free (I threw one in without any problems). As a result, ravens are already picking up the garbage bags and I can't imagine that she thinks it's nice if rats are added soon. I therefore appeal to the reason and decency of everyone to make the tiny effort to throw the bags INTO the container.   ",2015-05-18,1,0,0,0.1843972355127334,-0.857019224204123,0.1843972355127334,1,Garbage
555b02b682846366638b4577,"  Help the  to victory and vote for   and  ag under  If the  wins, the prize money will be invested in loan items for the settlement!   ",2015-05-19,1,0,0,0.5368035603314638,0.9750690241344272,0.5368035603314638,-1,Divers
555effa9828463c07f8b4697,"  When buying lamps and luminaires, make sure that they can be equipped with efficient light sources. A bright, reflective lampshade also enhances the  sure to buy LED, energy-saving lamps or fluorescent tubes. Tip: Photograph your old light bulbs Save the photo on your mobile phone to have the shape of the base and thread directly at hand and to be able to compare them well when shopping. Do not throw energy-saving lamps into the Bebbysack. Because of the mercury content, they belong in the hazardous waste. It's best to simply return them to the point of sale. Turn off the lights when you walk out of the room. Sounds obvious, but is often forgotten out of habit. If you haven't decided on a wall color yet: White walls enhance the lighting.Have fun doing something good for the environment!   ",2015-05-22,1,0,0,0.0380949676036834,0.1465183719992637,0.0380949676036834,22,Light
555f517d828463fb2a8b4569,"  Dear , I would like to place a bicycle pump in the bicycle storage room (in the middle of the underground car park), and maybe later a pair of simple tools so that the simple repairs can be easily done. It could be secured with a lock and chain combo so it doesn't disappear. :) I'm very happy to organize it, but I don't know if there is a requirement at all. The more we are, the less it costs per capita. For ~100 francs you could easily buy a robust, semi-professional pump that does not break . If you support the idea, I could organize a collection. Ich wünsche euch ein schönes lange Wochenende!     Dear ,I would like to place a pump in the Bikeroom (in the middle of the underground parking lot), and maybe a couple of tools, which can be used for some basic repairs. It would be secured with a chain and a lock to keep it safe. :) I could organize it and just would like to check if there is demand from anyone at all. The more we are, the less it costs. For about 100 CHF we could buy a steady, Semi-Professional pump, which will not brake down . Speak up if you support this idea and then I can organize the fund raising. Regards     ",2015-05-22,11,0,0,0.8311714129522443,8.293749337317422,0.8311714129522443,1,Garbage
557596858284639d1a8b466d,"   from  spoke about the 2000-watt certification of the Erlenmatt West site at 's new arrival reception. These are the most important milestones in the certification planning:Re-certification ""2000-watt area under development"" in / 2015Certification ""2000-watt area in operation"" not yet determined, planned for mid-2016More information about the certification ""2000-watt"" can be found under this link.Everything important about the past new arrivals is described under this link.   ",2015-06-08,1,0,0,0.5020431289449334,-0.3211398869752884,0.5020431289449334,28,Divers
5575fc4c8284639d1a8b474a,  Hello everyone. I live at  and found a blue terry cloth on the balcony . Does anyone miss that?   ,2015-06-08,3,0,0,0.4490962279960513,2.493778172880411,0.4490962279960513,24,Balcony
5576acfd82846380188b4646,"  Dear , Does anyone know if the garbage collection is? I have seen that  the container is already full and just want to know if there is a plan or it is claim-based? Thank you in advance,    ",2015-06-09,1,0,0,-0.1311826258897781,-0.6692751031368971,-0.1311826258897781,1,Garbage
557c51168284634b028b4677,"  I think it's a pity that the ""weeds"" should  be removed. Several people have already told me that they also enjoy the ""wild"" planting in the courtyard.   ",2015-06-13,4,0,0,-0.6689300294965506,0.7417268245480955,-0.6689300294965506,7,Pet
558a52438284630e728b467b,  Where should the visit be parked if it is no longer allowed in front of the house? It's blue zone everywhere.   ,2015-06-24,2,0,0,-0.4732719883322716,-0.2270344644784927,-0.4732719883322716,0,Parking/Car
558c07ba8284637e1b8b469d,"  Here are 4 simple energy-saving tips on the subject of stand-byThe best way to always completely disconnect your devices from the power when switing off. Convenient are power strips, whi you can swit off with a swit or a remote control. With many inkjet printers, it is important that you turn them off at the device swit beforehand. In any case, pull power supplies out of the socket after arging, because all argers that remain connected to the mains continue to consume electricity. Basically, the larger the power supply, the more power the devices  with all devices: Pay attention to a low standby consumption when buying. . regularly presents su products. To find the biggest power guzzlers at home, an energy cost meter is suitable - this is a device that you can place between the socket and the household appliance and with whi you can measure the power consumption of ea device.   ",2015-06-25,1,0,0,0.0616687387228012,0.5494594648480415,0.0616687387228012,17,Energy Consumption
558c2645828463d0438b458e,"  Dear  As part of an art project, I invite people to me to draw. What you just think of or notice or what you always wanted to draw. Whether it's a work of art or meaningless tingling. If you have the desire and courage, you can sit down at my table for  or more . Just come by and leave again when the desire evaporates. Drawing items are available. Coordinates:  ground floor Greetings    ",2015-06-25,4,0,0,0.585691780783236,1.879573383368552,0.585691780783236,3,Activities
558d4ebc8284634a648b4916,"  On my car in the underground car park  was the 2. Sometimes  the unfortunately unscrewable antenna stolen. Looking through the underground car park, I noticed that almost all the unscrewable antennas were missing. I approached a  who happened to be in the underground car park at his car . He had not even noticed the theft of his vehicle. I will report the theft. Not everyone has access to the underground car park. Increased attention and a webcam in the vehicle could help. In general, only  should have access to the garage.   ",2015-06-26,20,0,0,-0.6038227714598179,-5.235116446390748,-0.6038227714598179,30,Parking/Car
558f28468284631d118b4691,  Hello everyone Do any of you understand how to take out the pump filter of the washing machine to clean it? Somehow the whole thing looks completely different than in the instructions.   ,2015-06-27,3,0,0,-0.671134052798152,-1.8633844051510096,-0.671134052798152,10,Cleaning
5591383b828463eb6c8b4581,"  , we gave the tip to always completely disconnect all devices from the power. Plug strips are particularly suitable for this, which can be conveniently switched on and off. If you are not yet equipped accordingly, you may find something here: The Power Strip Swiss-Tec Comfort Switch from  for CHF 23.90 instead of 28.90, and the Steba E-Book socket strip from  for CHF 22.90 instead of 28.90 are available for a short time at a special price. (Postage-free delivery in Switzerland). More information and ordering options can be found here: , and here:    ",2015-06-29,1,0,0,0.6217753398232162,-0.0185257196426391,0.6217753398232162,21,Light
55919933828463497b8b458e,"  Dear !  As part of the first Ambassadors' Regulars' Table , we decided that we would like to set up a joint barbecue. Together means that (if possible?) all  of the Tangenten- and  should come together to chat together and meet new people! :-) The first appointment is on . In case of bad weather, the whole thing will be on  the 16th. ==References== The place of action is the courtyard (i.e. right in front of the front door). :-) Banquet benches are organized by us. However, we ask you to bring a salad/cake and something drinkable (water/soft drinks/beer/wine), as well as your own crockery/cutlery. So that everything runs a bit organized, please register at the link below. We are looking forward to numerous invitations! :-)  If you have any questions, please do not hesitate to contact me. Best regards,    Dearest ! During our first  Ambassadoren-Stammtisch , we decided to plan a community barbeque. All  of the Tangentenweg and  can come together and get to meet new and interesting people in the area! ☺ The first date is , 19th of July. If the weather doesn’t hold up, the whole event would be postponed to , 16th of August. The location is the Innenhof between the two buildings (right outside the door!) ☺ We will organise tables and benches, however we do ask you to bring salads/desserts, beverages (Water/Soda Pops/Beers/Wines) and your own Dishes/Cutlery. In order for things to run smoothly and planned, we would like you to write sign up using the following link. We are looking forward to numerous ! ☺ If you have questions, do not hesitate to ask. Best Regards      ",2015-06-29,6,0,0,0.7034925501793623,4.218697624863125,0.7034925501793623,3,Activities
5592f95b828463390d8b468f,"  I started a new topic because you can't attach photos when answering. It is about the alleged car antenna theft in our underground car park. I am  completely convinced that it is a marten pestolem. If you google you will find many similar examples and around my antenna there are marten tracks on the car roof. You can only see the traces depending on the incidence of light. On the attached photo I have increased the contrast. I have also seen such traces in other cars. With my antenna, the plastic seems a bit broken/nibbled. What can we do about it? Is the marten perhaps even ""trapped"" in the underground car park?   ",2015-06-30,12,0,0,-0.2655490487813949,-4.587151387706399,-0.2655490487813949,30,Parking/Car
55977c4782846311088b4595,"  Dear  I can understand that after moving in, the garbage and the huge pile of cardboard should get out of the new home . Everyone wants normality to return very quickly and that you don't have to cope with umpteen clean-up work. For this reason, I ask you to clear away the black, non-official!, garbage bags filled with cardboard and Sagex and other plastic, from the waste collection point at . And that is before the whole pile is softened by thunderstorms and heat and becomes a smelly broth in front of our entrance. In order to do the whole thing as easily and quickly as possible, the civil engineering office offers various solutions: 1) You stick a waste stamp on each bag and report the collection via the website. I assure you that it will work. 2) You separate the garbage correctly and bundle the box. Cords and ""Bebbisegg"", the official garbage bags of the city, are available for a small amount in every  or  branch. 3) You pack the mountain in your car and drive to the factory yard (direction St. Louis border), where you can dispose of everything, correctly separated of course, for little money. What is guaranteed not to work is ignore and wait for someone else to take care of it. Especially since the civil engineering office has already reliably removed the garbage a few times, down to your pile, and thus proved that they will ignore their mountain at most until St. Never's Day. And so far, all parties have been able to move in without major pollution and return to  life. Ergo, you can do it too!  In the hope that my push for community-friendly action will reach and inspire you Best regards and good settling in, a roommate   ",2015-07-04,8,0,0,-0.4634335488080978,-4.169652899261564,-0.4634335488080978,1,Garbage
5597e2f2828463667a8b4593,"  It already has a  regarding. Carton removal written. I would like to join her.  at  I put a TV box filled with the packaging material in the entrance area so that it does not soften. I ask those affected to dispose of this correctly, because the box is still there and no one feels addressed. The second concern concerns the underfloor containers. Despite repeated requests from , Bebbi bags have once again stood next to it on the , although there is enough space in the container. Especially in this heat a mess. Again, I ask you to dispose of them correctly, I don't feel like doing this for others every time! Please follow the rules, it makes living together much easier...   ",2015-07-04,1,0,0,-0.0986981987953186,-0.8990596691146493,-0.0986981987953186,1,Garbage
559f89e882846303568b46ff,  Dear  of  I have noticed that the door does not close properly. I have already reported it to the . But please make sure that the door behind you is closed properly.  Have checked it  .   ,2015-07-10,2,0,0,-0.6627675462514162,-0.8200716506689787,-0.6627675462514162,2,Security
55a3ec1782846386388b465e,"  Dear ! As part of the first Ambassadors' Regulars' Table , we decided that we would like to set up a joint barbecue. Together means that (if possible?) all  of the Tangenten- and  should come together to chat together and meet new people! :-) The first appointment is on . In case of bad weather, the whole thing will be on  the 16th. ==References== The place of action is the courtyard (i.e. right in front of the front door). :-) Banquet benches are organized by us. However, we ask you to bring a salad/cake and something drinkable (water/soft drinks/beer/wine), as well as your own crockery/cutlery/grill. So that everything runs a bit organized, please register at the link below. We are looking forward to numerous invitations! :-) If you have any questions, please do not hesitate to contact me. Best regards,   Dearest  During our first  Ambassadoren-Stammtisch , we decided to plan a community barbeque. All  of the Tangentenweg and  can come together and get to meet new and interesting people in the area! ☺ The first date is , 19th of July. If the weather doesn’t hold up, the whole event would be postponed to , 16th of August. The location is the Innenhof between the two buildings (right outside the door!) ☺ We will organise tables and benches, however we do ask you to bring salads/desserts, beverages (Water/Soda Pops/Beers/Wines) and your own Dishes/Cutlery. In order for things to run smoothly and planned, we would like you to write sign up using the following link. We are looking forward to numerous ! ☺ If you have questions, do not hesitate to ask. Best Regards     ",2015-07-13,1,0,0,0.7129804138094187,-0.0432762280106544,0.7129804138094187,3,Activities
55acd8d98284635f3a8b464f,  We provide the cakes and cupcakes for all the occasions .we also provide Vegan cakes . We make it with natural products freshly .we also give you in reasonable prices.   ,2015-07-20,1,0,0,0.844719766639173,0.0378642436116933,0.844719766639173,19,Food
55aff096828463817a8b4574,"  Hello!!! I ( ) saw the Bengal cat!!  the 22. ==References=. It ran over the entire construction site in the direction of the new block which is still being built. It rained, so maybe he came back!  I went out immediately and tried to find him, unfortunately in vain. Don't get through the locked grids. If you need more information you are welcome to contact us. Kind regards  Again   ",2015-07-22,2,0,0,-0.0484597384929657,0.6966613996773958,-0.0484597384929657,-1,Divers
55c0afa3828463cf578b4671,"  On , 12.   the  2. New arrivals aperitif in the restaurant Le S. Get to know your  and then go to the Silofest together with us! Details and registration:  _________________________ On ,  12th at 4 p.m. we welcome you to a ""Get-to-know-your--Apéro for the Erlenmatt West Quartier. Get to know your fellow  and come along with us when we afterwards go together to the Silofest! More information and RSVP:    ",2015-08-04,1,0,0,0.7667456611525267,0.9905076794093476,0.7667456611525267,3,Activities
55c9069882846393638b4610,"  Do you want to help shape the Erlenmatt West neighbourhood? Would you like to make a wide range of contacts in the district? Do you want to develop and implement ideas? Contribute something to the quality of life in the district? Come to the next  Erlenmatt West Stammtisch and get involved in your neighbourhood. We meet in the railway canteen to exchange ideas. Possible initiatives are: Quartierfest photo project ""Faces of Erlenmatt"" Sustainability Days ... their own idea? REGISTER  If you would like to be part of it, please select all dates that would suit you. We are currently in the process of scheduling:  __________________ Would you like to shape the Erlenmatt West neighborhood? Would you like to meet your fellow ? Would you like to do something for the community? Join us for the next Erlenmatt West  Roundtable. We meet at the Bahnkantine Restaurant. Possible initiatives are a neighborhood festival, a photo project , sustainability days.... or your own idea? REGISTER : If you'd like to join our next roundtable, please tick off all the times that would work for you: .   ",2015-08-10,1,0,0,0.3459582165814936,0.9826288875192404,0.3459582165814936,-1,Divers
55d5b3cd82846342528b45c4,"  Dear ,  I have provided a pump in the VeloRaum (about in the middle) for your disposal. Greetings,   Dear all, A bike pump is available for you in the middle of the bikeroom. Regards,     ",2015-08-20,6,0,0,0.5100588239729404,5.915350348630454,0.5100588239729404,1,Garbage
55db32fa82846322328b4576,"  You can  view your consumption of electricity, hot water and heating by going to the ""My Energy"" tile. There you can see your consumption per apartment and per person, and also the average per person for the Erlenmatt West. And soon you will also find the planning value for the 2000-watt area there. Please note: The function for the energy data is still in the test phase, i.e. errors  still creep in. If you discover an error or notice something, we look forward to receiving a message – just write an e-mail to . Even if you like something particularly well!   ",2015-08-24,2,0,0,-0.0680554807186126,0.28504379093647,-0.0680554807186126,17,Energy Consumption
55db6a6f82846322328b468b,"  Hey guys My antenna has already been stolen 2 times from my car and I gradually believe that someone is stealing the antennas of the cars at . I wanted to give you an advance warning. Please keep an eye open and if necessary, unscrew the antenna when leaving your vehicle. Greeting   ",2015-08-24,3,0,0,-0.7584933396428823,0.2241768259555101,-0.7584933396428823,30,Parking/Car
55decc93828463f9348b4567,"  Have you noticed it yet? Slowly but surely, it is also coming alive on construction site E! At this point, we from the  team would like to warmly welcome all  to construction site E on the app and in the district! By the way: If someone wants to greet the """" as a long-established , then write a nice, funny, warm or informative comment on this post. Also a very good idea: Come to the Neuzuzügerapero AND / ODER to the Silofest on .  and get to know the new and the old s personally. More information here: https://www..ch/community-articles/55c0afa3828463cf578b4671    ",2015-08-27,1,0,0,0.9336911607533692,0.982672929763794,0.9336911607533692,15,Activities
